{
  "schemaVersion": 1,
  "id": "vk-neighbour-exchange",
  "request": "Сделать мимикрию для ВКонтакте, которая помогает соседям обмениваться редко нужными вещами без общего шумного чата",
  "audience": {
    "primary": "Жители больших многоквартирных домов, готовые помогать соседям в пределах короткой прогулки",
    "needs": [
      "Быстро найти редкую бытовую вещь на один вечер",
      "Понимать, кому можно доверить свою вещь и когда она вернётся"
    ],
    "exclusions": ["Профессиональные арендодатели", "Публичная доска объявлений всего города"]
  },
  "context": {
    "situations": [
      "Перед домашней задачей выясняется, что нужный инструмент покупать ради одного раза неразумно",
      "Сосед готов одолжить вещь, если понятны человек, срок и способ возврата"
    ],
    "constraints": [
      "Ценность должна появиться в пределах одного дома до роста большой сети",
      "Разрешения запрашиваются только из понятного пользовательского действия",
      "Нельзя выдавать fixture evidence за реальные исследования"
    ]
  },
  "reference": {
    "strategy": "mimicry",
    "family": "vk-family",
    "profileId": "vk-ios"
  },
  "permissions": [
    { "key": "camera", "priority": "required", "constraint": "Нужна только для фотографии конкретной предлагаемой вещи" },
    { "key": "location", "priority": "required", "constraint": "Нужна для выбора ближайшего дома; адрес можно выбрать вручную" },
    { "key": "push", "priority": "required", "constraint": "Нужна после подписки на запрос или подтверждения выдачи" }
  ],
  "candidateCount": 3
}
